{
  "$schema": "https://json-schema.org/draft/2020-12/schema",
  "$id": "https://raw.githubusercontent.com/openwallet-foundation/eudiplo/refs/heads/main/schemas/CredentialConfigUpdate.schema.json",
  "title": "CredentialConfigUpdate",
  "type": "object",
  "properties": {
    "vct": {
      "description": "VCT as a URI string (e.g., urn:eudi:pid:de:1) or as an object for EUDIPLO-hosted VCT",
      "anyOf": [
        {
          "type": "string",
          "description": "VCT URI string"
        },
        {
          "$ref": "./VCT.schema.json"
        },
        {
          "type": "null"
        }
      ]
    },
    "iaeActions": {
      "type": "array",
      "nullable": true,
      "description": "List of IAE actions to execute before credential issuance",
      "example": "",
      "items": {
        "oneOf": [
          {
            "$ref": "./IaeActionOpenid4vpPresentation.schema.json"
          },
          {
            "$ref": "./IaeActionRedirectToWeb.schema.json"
          }
        ]
      }
    },
    "schemaMeta": {
      "nullable": true,
      "description": "TS11 schema metadata configuration for EUDI Catalogue of Attestations.\n\nWhen present, EUDIPLO can generate a SchemaMeta object per the TS11 spec\nusing the GET /issuer/credentials/:id/schema-metadata endpoint.\n\n The underlying TS11 specification is not yet finalized.",
      "type": "object",
      "allOf": [
        {
          "$ref": "./SchemaMetaConfig.schema.json"
        }
      ]
    },
    "embeddedDisclosurePolicy": {
      "nullable": true,
      "description": "Embedded disclosure policy (discriminated union by `policy`).\nThe discriminator makes class-transformer instantiate the right subclass,\nand then class-validator runs that subclass’s rules.",
      "oneOf": [
        {
          "$ref": "./AttestationBasedPolicy.schema.json"
        },
        {
          "$ref": "./NoneTrustPolicy.schema.json"
        },
        {
          "$ref": "./AllowListPolicy.schema.json"
        },
        {
          "$ref": "./RootOfTrustPolicy.schema.json"
        }
      ],
      "allOf": [
        {
          "$ref": "./EmbeddedDisclosurePolicy.schema.json"
        }
      ]
    },
    "id": {
      "type": "string"
    },
    "description": {
      "type": "string",
      "nullable": true
    },
    "config": {
      "$ref": "./IssuerMetadataCredentialConfig.schema.json"
    },
    "fields": {
      "type": "array",
      "items": {
        "$ref": "./ClaimFieldDefinitionDto.schema.json"
      }
    },
    "attributeProviderId": {
      "type": "string",
      "nullable": true,
      "description": "Reference to the attribute provider used for fetching claims.\nOptional: if set, claims will be fetched from this provider during issuance."
    },
    "webhookEndpointId": {
      "type": "string",
      "nullable": true,
      "description": "Reference to the webhook endpoint used for notifications.\nOptional: if set, notifications will be sent to this endpoint."
    },
    "keyBinding": {
      "type": "boolean"
    },
    "keyChainId": {
      "type": "string",
      "description": "Reference to the key chain used for signing.\nOptional: if not specified, the default attestation key chain will be used."
    },
    "statusManagement": {
      "type": "boolean"
    },
    "sdJwtTrustFormat": {
      "nullable": true,
      "description": "For SD-JWT credentials: determines whether to include certificate chain (x5c)\nor use federation-based trust (iss claim).\nDefault: \"x5c\" (federation must be explicitly selected)",
      "enum": [
        "x5c",
        "federation"
      ],
      "type": "string"
    },
    "lifeTime": {
      "type": "number"
    }
  },
  "additionalProperties": false
}