{
  "id": "citizen",
  "description": "Citizen issuance with IAE flow",
  "config": {
    "format": "dc+sd-jwt",
    "display": [
      {
        "name": "Citizen Pass",
        "background_color": "#FFFFFF",
        "background_image": {
          "uri": "credential.png"
        },
        "description": "A pass for this citizen",
        "locale": "en-US",
        "text_color": "#000000"
      }
    ]
  },
  "iaeActions": [
    {
      "type": "openid4vp_presentation",
      "presentationConfigId": "pid",
      "label": "KYC process"
    }
  ],
  "vct": {
    "name": "Citizen",
    "description": "This is our development version of the education credential. Don't panic."
  },
  "fields": [
    {
      "path": [
        "town"
      ],
      "type": "string",
      "defaultValue": "BERLIN",
      "mandatory": true,
      "disclosable": false
    }
  ]
}