{
  "id": "pid-mdoc",
  "description": "Personal ID as mDOC",
  "config": {
    "format": "mso_mdoc",
    "docType": "eu.europa.ec.eudi.pid.1",
    "scope": "pid",
    "display": [
      {
        "name": "PID (mDOC)",
        "description": "Personal ID Credential",
        "locale": "en-US"
      }
    ]
  },
  "keyBinding": true,
  "statusManagement": true,
  "lifeTime": 604800,
  "fields": [
    {
      "path": [
        "eu.europa.ec.eudi.pid.1",
        "age_birth_year"
      ],
      "type": "integer",
      "defaultValue": 1964,
      "namespace": "eu.europa.ec.eudi.pid.1"
    },
    {
      "path": [
        "eu.europa.ec.eudi.pid.1",
        "age_in_years"
      ],
      "type": "integer",
      "defaultValue": 61,
      "namespace": "eu.europa.ec.eudi.pid.1"
    },
    {
      "path": [
        "eu.europa.ec.eudi.pid.1",
        "age_over_12"
      ],
      "type": "boolean",
      "defaultValue": true,
      "namespace": "eu.europa.ec.eudi.pid.1"
    },
    {
      "path": [
        "eu.europa.ec.eudi.pid.1",
        "age_over_14"
      ],
      "type": "boolean",
      "defaultValue": true,
      "namespace": "eu.europa.ec.eudi.pid.1"
    },
    {
      "path": [
        "eu.europa.ec.eudi.pid.1",
        "age_over_16"
      ],
      "type": "boolean",
      "defaultValue": true,
      "namespace": "eu.europa.ec.eudi.pid.1"
    },
    {
      "path": [
        "eu.europa.ec.eudi.pid.1",
        "age_over_18"
      ],
      "type": "boolean",
      "defaultValue": true,
      "namespace": "eu.europa.ec.eudi.pid.1"
    },
    {
      "path": [
        "eu.europa.ec.eudi.pid.1",
        "age_over_21"
      ],
      "type": "boolean",
      "defaultValue": true,
      "namespace": "eu.europa.ec.eudi.pid.1"
    },
    {
      "path": [
        "eu.europa.ec.eudi.pid.1",
        "age_over_65"
      ],
      "type": "boolean",
      "defaultValue": false,
      "namespace": "eu.europa.ec.eudi.pid.1"
    },
    {
      "path": [
        "eu.europa.ec.eudi.pid.1",
        "birth_date"
      ],
      "type": "string",
      "defaultValue": "1964-08-12",
      "mandatory": true,
      "constraints": {
        "pattern": "^\\d{4}-\\d{2}-\\d{2}$"
      },
      "namespace": "eu.europa.ec.eudi.pid.1"
    },
    {
      "path": [
        "eu.europa.ec.eudi.pid.1",
        "birth_place"
      ],
      "type": "string",
      "defaultValue": "BERLIN",
      "namespace": "eu.europa.ec.eudi.pid.1"
    },
    {
      "path": [
        "eu.europa.ec.eudi.pid.1",
        "expiry_date"
      ],
      "type": "string",
      "defaultValue": "2035-01-14",
      "mandatory": true,
      "constraints": {
        "pattern": "^\\d{4}-\\d{2}-\\d{2}$"
      },
      "namespace": "eu.europa.ec.eudi.pid.1"
    },
    {
      "path": [
        "eu.europa.ec.eudi.pid.1",
        "family_name_birth"
      ],
      "type": "string",
      "defaultValue": "GABLER",
      "namespace": "eu.europa.ec.eudi.pid.1"
    },
    {
      "path": [
        "eu.europa.ec.eudi.pid.1",
        "family_name"
      ],
      "type": "string",
      "defaultValue": "MUSTERMANN",
      "mandatory": true,
      "namespace": "eu.europa.ec.eudi.pid.1"
    },
    {
      "path": [
        "eu.europa.ec.eudi.pid.1",
        "given_name"
      ],
      "type": "string",
      "defaultValue": "ERIKA",
      "mandatory": true,
      "namespace": "eu.europa.ec.eudi.pid.1"
    },
    {
      "path": [
        "eu.europa.ec.eudi.pid.1",
        "issuance_date"
      ],
      "type": "string",
      "defaultValue": "2025-01-14",
      "mandatory": true,
      "constraints": {
        "pattern": "^\\d{4}-\\d{2}-\\d{2}$"
      },
      "namespace": "eu.europa.ec.eudi.pid.1"
    },
    {
      "path": [
        "eu.europa.ec.eudi.pid.1",
        "issuing_authority"
      ],
      "type": "string",
      "defaultValue": "DE",
      "mandatory": true,
      "namespace": "eu.europa.ec.eudi.pid.1"
    },
    {
      "path": [
        "eu.europa.ec.eudi.pid.1",
        "issuing_country"
      ],
      "type": "string",
      "defaultValue": "DE",
      "mandatory": true,
      "namespace": "eu.europa.ec.eudi.pid.1"
    },
    {
      "path": [
        "eu.europa.ec.eudi.pid.1",
        "nationality"
      ],
      "type": "string",
      "defaultValue": "DE",
      "namespace": "eu.europa.ec.eudi.pid.1"
    },
    {
      "path": [
        "eu.europa.ec.eudi.pid.1",
        "resident_city"
      ],
      "type": "string",
      "defaultValue": "KÖLN",
      "namespace": "eu.europa.ec.eudi.pid.1"
    },
    {
      "path": [
        "eu.europa.ec.eudi.pid.1",
        "resident_country"
      ],
      "type": "string",
      "defaultValue": "DE",
      "namespace": "eu.europa.ec.eudi.pid.1"
    },
    {
      "path": [
        "eu.europa.ec.eudi.pid.1",
        "resident_postal_code"
      ],
      "type": "string",
      "defaultValue": "51147",
      "namespace": "eu.europa.ec.eudi.pid.1"
    },
    {
      "path": [
        "eu.europa.ec.eudi.pid.1",
        "resident_street"
      ],
      "type": "string",
      "defaultValue": "HEIDESTRAẞE 17",
      "namespace": "eu.europa.ec.eudi.pid.1"
    },
    {
      "path": [
        "eu.europa.ec.eudi.pid.1",
        "source_document_type"
      ],
      "type": "string",
      "defaultValue": "id_card",
      "namespace": "eu.europa.ec.eudi.pid.1"
    }
  ]
}